A,B,C,NOMBRE_PATRONO,NIT_AGRUPADOR
1,2,3,CDE CENTRO ESCOLAR JOSE AMADEO CEDILLOS,11132802971015
1,2,3,CDE CENTRO ESCOLAR JOSE ANTONIO LAZO,14161009011010
1,2,3,CDE CENTRO ESCOLAR JOSE ANTONIO MORA CANTON PLANES SEGUNDOS,12051911941011
1,2,3,CDE CENTRO ESCOLAR JOSE ANTONIO SALAVERRIA,06140411141096
1,2,3,CDE CENTRO ESCOLAR JOSE EVARISTO MEJIA,12081209971017
1,2,3,CDE CENTRO ESCOLAR JOSE MARIA CACERES,05221402971015
1,2,3,CDE CENTRO ESCOLAR JOSE MARIANO CALDERON,06152102971031
1,2,3,CDE CENTRO ESCOLAR JOSE MARTI,06140111972034
1,2,3,CDE CENTRO ESCOLAR JOSE MATIAS DELGADO,06141402971147
1,2,3,CDE CENTRO ESCOLAR JOSE MEJIA,06142102972148
1,2,3,CDE CENTRO ESCOLAR JOSE QUETGLAS,06141402971210
1,2,3,CDE CENTRO ESCOLAR JOSE RAMON BARAHONA,11082410141084
1,2,3,CDE CENTRO ESCOLAR JOSE SIMEON CAÑAS,06142802971320
1,2,3,CDE CENTRO ESCOLAR JOSE VAQUERANO,08213006991010
1,2,3,CDE CENTRO ESCOLAR JUAN DE DIOS DEL CID,06142102971893
1,2,3,CDE CENTRO ESCOLAR JUAN JOSE CAÑAS,06142205981080
1,2,3,CDE CENTRO ESCOLAR JUAN JOSE SOLORZANO,03020402991013
1,2,3,CDE CENTRO ESCOLAR JUAN PABLO ESPINOZA,12152102971019
1,2,3,CDE CENTRO ESCOLAR JUAN RAMON JIMENEZ,05122802971059
1,2,3,CDE CENTRO ESCOLAR JUAN RAMON URIARTE,06142102971540
1,2,3,CDE CENTRO ESCOLAR JUANA LOPEZ,06192009031012
1,2,3,CDE CENTRO ESCOLAR JULIAN APARICIO,12050703971035
1,2,3,CDE CENTRO ESCOLAR JULIAN VASQUEZ ROJAS,03011402971013
1,2,3,CDE CENTRO ESCOLAR JULIO ENRIQUE AVILA,04132102971033
1,2,3,CDE CENTRO ESCOLAR LA CIMA DOS,06182003001019
1,2,3,CDE CENTRO ESCOLAR LA PAZ,06142802971819
1,2,3,CDE CENTRO ESCOLAR LA PONDEROSA,06021706981011
1,2,3,CDE CENTRO ESCOLAR LAURA URQUILLA VIUDA DE AZURDIA,09092807011019
1,2,3,CDE CENTRO ESCOLAR LEONARDO AZCUNAGA,06170703971029
1,2,3,CDE CENTRO ESCOLAR LIC WALTER BENEKE,05180705011016
1,2,3,CDE CENTRO ESCOLAR LICENCIADA LESLIE S. VOGEL,12171402971023
1,2,3,CDE CENTRO ESCOLAR LICENCIADO ALFREDO FELIX CRISTIANI BURKARD,06022102971014
1,2,3,CDE CENTRO ESCOLAR LICENCIADO JUAN JOSE  GUZMAN,13172802971049
1,2,3,CDE CENTRO ESCOLAR LICENCIADO RENATO NOYOLA,06022504011017
1,2,3,CDE CENTRO ESCOLAR LIGA PANAMERICANA,06141402971368
1,2,3,CDE CENTRO ESCOLAR LISANDRO LARIN ZEPEDA,03012102971018
1,2,3,CDE CENTRO ESCOLAR LOTIF LOS AMATES CT STA EMILIA,03152310141076
1,2,3,CDE CENTRO ESCOLAR LUCIA DE VILLACORTA,08212102971031
1,2,3,CDE CENTRO ESCOLAR LUZ DE SOTOMAYOR,05092802971079
1,2,3,CDE CENTRO ESCOLAR LUZ GOMEZ,02072802971050
1,2,3,CDE CENTRO ESCOLAR MANUEL ALVAREZ MAGAÑA,01031402971025
1,2,3,CDE CENTRO ESCOLAR MANUEL JOSE ARCE,12172802971134
1,2,3,CDE CENTRO ESCOLAR MANUELA EDELMIRA CORDOVA,11231402971065
1,2,3,CDE CENTRO ESCOLAR MARCELINO GARCIA FLAMENCO,05112802771062
1,2,3,CDE CENTRO ESCOLAR MARIA ESCOBAR GRANILLO,12172701001010
1,2,3,CDE CENTRO ESCOLAR MARIA LUCINDA VARGAS,12202102971016
1,2,3,CDE CENTRO ESCOLAR MARIA LUISA PARADA,12092102971024
1,2,3,CDE CENTRO ESCOLAR MARIA LUISA VIUDA DE MARIN,10070703971012
1,2,3,CDE CENTRO ESCOLAR MARIA PAZ CRISTINA MONTES,13142710141060
1,2,3,CDE CENTRO ESCOLAR MARIO GOMEZ,14040111971042
1,2,3,CDE CENTRO ESCOLAR MENENDEZ,06140111971860
1,2,3,CDE CENTRO ESCOLAR METROPOLITANO,04072102971065
1,2,3,CDE CENTRO ESCOLAR MIGUEL ANGEL GARCIA,05122802971016
1,2,3,CDE CENTRO ESCOLAR MIGUEL ELIAS GUILLEN,04162102971030
1,2,3,CDE CENTRO ESCOLAR MIGUEL GUEVARA,11201403971011
1,2,3,CDE CENTRO ESCOLAR MILAGRO DE LA PAZ,12171402971040
1,2,3,CDE CENTRO ESCOLAR MIRTALA YANEZ DE JIMENEZ,14111402971028
1,2,3,CDE CENTRO ESCOLAR MONSEÑOR OSCAR ARNULFO ROMERO Y GALDAMEZ,12071402971010
1,2,3,CDE CENTRO ESCOLAR MORELIA,08190703971019
1,2,3,CDE CENTRO ESCOLAR NAPOLEON RIOS,06140111971259
1,2,3,CDE CENTRO ESCOLAR NATALIA LOPEZ,05160703971011
1,2,3,CDE CENTRO ESCOLAR NEMESIA LUNA,05182102971012
1,2,3,CDE CENTRO ESCOLAR NESTOR SALAMANCA,07022802971043
1,2,3,CDE CENTRO ESCOLAR NIÑO JESUS DE PRAGA,12171402971082
1,2,3,CDE CENTRO ESCOLAR ORGANIZACION DE ESTADOS IBEROAMERICANOS,05112802971037
1,2,3,CDE CENTRO ESCOLAR PABLO J AGUIRRE,12172802971037
1,2,3,CDE CENTRO ESCOLAR PARAISO REAL,14062907630015
1,2,3,CDE CENTRO ESCOLAR PEDRO PABLO CASTILLO,05102102971014
1,2,3,CDE CENTRO ESCOLAR PLAYA LOS COBANOS,06142102971389
1,2,3,CDE CENTRO ESCOLAR PLAYA SAN DIEGO,05092802971044
1,2,3,CDE CENTRO ESCOLAR PONCIANA RAMIREZ,04332802971050
1,2,3,CDE CENTRO ESCOLAR PRESBITERO JOSE LUIS MARTINEZ,03070703971023
1,2,3,CDE CENTRO ESCOLAR PRESBITERO NICOLAS AGUILAR,06181402971017
1,2,3,CDE CENTRO ESCOLAR PRESBITERO NORBERTO CRUZ,13190601971014
1,2,3,CDE CENTRO ESCOLAR PRESBITERO NORBERTO MARROQUIN,10132102971029
1,2,3,CDE CENTRO ESCOLAR PRESBITERO RAFAEL PAZFUENTES,06142102971150
1,2,3,CDE CENTRO ESCOLAR PRESBITERO RAUL ANTONIO RIVAS,04032102971012
1,2,3,CDE CENTRO ESCOLAR PROF CONCEPCION ALEMAN CORDOVA,11232802971028
1,2,3,CDE CENTRO ESCOLAR PROF DOLORES DE      JESUS MONTOYA,11212802971019
1,2,3,CDE CENTRO ESCOLAR PROF LILIAN ISABEL   PEÑA DE ORELLANA,12172010991014
1,2,3,CDE CENTRO ESCOLAR PROF Y DR EFRAIN   JOVEL,11080703971011
1,2,3,CDE CENTRO ESCOLAR PROFESOR DANIEL CORDON SALGUERO,06172802971017
1,2,3,CDE CENTRO ESCOLAR PROFESOR FRANCISCO MORAN,04302102971010
1,2,3,CDE CENTRO ESCOLAR PROFESOR IRENEO DE LEON,08101202021018
1,2,3,CDE CENTRO ESCOLAR PROFESOR JESUS LEOCADIO PALENCIA,05172802971013
1,2,3,CDE CENTRO ESCOLAR PROFESOR JORGE SALOMON GRANADOS,12051102971018
1,2,3,CDE CENTRO ESCOLAR PROFESOR JOSE ANGEL CASTILLO,09062102991018
1,2,3,CDE CENTRO ESCOLAR PROFESOR JUAN OSCAR SALOMON,08210202891010
1,2,3,CDE CENTRO ESCOLAR PROFESOR JUAN ROBERTO JUAREZ,09030111971047
1,2,3,CDE CENTRO ESCOLAR PROFESOR JUSTO GONZALEZ,06122908971019
1,2,3,CDE CENTRO ESCOLAR PROFESOR LISANDRO AREVALO,11112802971030
1,2,3,CDE CENTRO ESCOLAR PROFESOR LUIS SAMUEL CACERES,12082802971011
1,2,3,CDE CENTRO ESCOLAR PROFESOR RAFAEL OSORIO HIJO,08170111971015
1,2,3,CDE CENTRO ESCOLAR PROFESOR SAUL FLORES,11092402971014
1,2,3,CDE CENTRO ESCOLAR PROFESORA ANA ROGELIA CRUZ,11091307621018
1,2,3,CDE CENTRO ESCOLAR PROFESORA BLANCA RAMIREZ DE AVILES,11231402971030
1,2,3,CDE CENTRO ESCOLAR PROFESORA HERMINIA MARTINEZ ALVARENGA,06142802971533
1,2,3,CDE CENTRO ESCOLAR PROFESORA JOSEFA     VALLE DE FUENTES,13192802971058
1,2,3,CDE CENTRO ESCOLAR PROFESORA MARIA INOCENCIA DE PAREDES,06182102971046
1,2,3,CDE CENTRO ESCOLAR PROFESORA MARIA JULIAALVARADO MADRID DE GARCIA,05122802971032
1,2,3,CDE CENTRO ESCOLAR PROFESORA ROMILIA SILVA DE RODRIGUEZ,06141402971295
1,2,3,CDE CENTRO ESCOLAR PRUDENCIA AYALA,03152310141165
1,2,3,CDE CENTRO ESCOLAR PUERTO EL TRIUNFO,11142103971013
1,2,3,CDE CENTRO ESCOLAR RAFAEL BARRAZA RODRIGUEZ,07031403971012
1,2,3,CDE CENTRO ESCOLAR RAFAELA SOTOMAYOR DE ALARCIA,06140703971405
1,2,3,CDE CENTRO ESCOLAR RAMIRO MARTINEZ PINEDA,11082802971042
1,2,3,CDE CENTRO ESCOLAR RAMON MENDOZA,14121403971019
1,2,3,CDE CENTRO ESCOLAR REFUGIO DE LA PAZ,05111403971027
1,2,3,CDE CENTRO ESCOLAR REFUGIO SIFONTES,06191402971012
1,2,3,CDE CENTRO ESCOLAR REINO DE DINAMARCA,06171209971012
1,2,3,CDE CENTRO ESCOLAR REINO DE HOLANDA,06192102971050
1,2,3,CDE CENTRO ESCOLAR REINO DE SUECIA,06081704011018
1,2,3,CDE CENTRO ESCOLAR RENE ARMANDO ARCE SUAREZ,06142102971400
1,2,3,CDE CENTRO ESCOLAR REPARTO LOS SANTOS,06170905971012
1,2,3,CDE CENTRO ESCOLAR REPARTO VALLE NUEVO,06142802971134
1,2,3,CDE CENTRO ESCOLAR REPUBLICA DE ALEMANIA,06142103971170
1,2,3,CDE CENTRO ESCOLAR REPUBLICA DE COLOMBIA,06141403971264
1,2,3,CDE CENTRO ESCOLAR REPUBLICA DE COREA,06172203011013
1,2,3,CDE CENTRO ESCOLAR REPUBLICA DE COSTA RICA,06142802971339
1,2,3,CDE CENTRO ESCOLAR REPUBLICA DE FRANCIA,06082802971026
1,2,3,CDE CENTRO ESCOLAR REPUBLICA DE GUATEMALA,06141403971086
1,2,3,CDE CENTRO ESCOLAR REPUBLICA DE HAITI,03152802971040
1,2,3,CDE CENTRO ESCOLAR REPUBLICA DE HONDURAS,04070703971019
1,2,3,CDE CENTRO ESCOLAR REPUBLICA DE LIBANO,06142802971576
1,2,3,CDE CENTRO ESCOLAR REPUBLICA DE NICARAGUA,06142802971506
1,2,3,CDE CENTRO ESCOLAR REPUBLICA DE NICARAGUA .,06142802971509
1,2,3,CDE CENTRO ESCOLAR REPUBLICA DEL ECUADOR,06141402971120
1,2,3,CDE CENTRO ESCOLAR REPUBLICA DOMINICANA,06082102971041
1,2,3,CDE CENTRO ESCOLAR REPUBLICA FEDERADA CENTROAMERICANA,06140111971232
1,2,3,CDE CENTRO ESCOLAR REPUBLICA FEDERAL CENTROAMERICANA,11082802971026
1,2,3,CDE CENTRO ESCOLAR REPUBLICA ORIENTAL DEL URUGUAY,06083005971017
1,2,3,CDE CENTRO ESCOLAR RESIDENCIAL LA PRADERA,12171706021030
1,2,3,CDE CENTRO ESCOLAR REYES ZELAYA,11181403971010
1,2,3,CDE CENTRO ESCOLAR RICARDO TRIGUEROS DE LEON,06141402971236
1,2,3,CDE CENTRO ESCOLAR ROBERTO EDMUNDO CANESSA,11182102971020
1,2,3,CDE CENTRO ESCOLAR ROQUE DALTON,06011402971014
1,2,3,CDE CENTRO ESCOLAR RUBEN DARIO,06162802971011
1,2,3,CDE CENTRO ESCOLAR SACACOYO,05132802971011
1,2,3,CDE CENTRO ESCOLAR SAGRADO CORAZON,12172802971096
1,2,3,CDE CENTRO ESCOLAR SALARRUE,04311402971029
1,2,3,CDE CENTRO ESCOLAR SALOMON DAVID GONZALEZ,03060606971013
1,2,3,CDE CENTRO ESCOLAR SALVADOR MARTINEZ FIGUEROA,02130111971038
1,2,3,CDE CENTRO ESCOLAR SAN AGUSTIN,08212802971032
1,2,3,CDE CENTRO ESCOLAR SAN ANTONAIO ABAD,06142102971923
1,2,3,CDE CENTRO ESCOLAR SAN ANTONIO,06172807031012
1,2,3,CDE CENTRO ESCOLAR SAN ARTURO,05090605981019
1,2,3,CDE CENTRO ESCOLAR SAN BARTOLOME PERULAPIA,07071403971014
1,2,3,CDE CENTRO ESCOLAR SAN CRISTOBAL,07082802971011
1,2,3,CDE CENTRO ESCOLAR SAN FRANCISCO,08212802971121
1,2,3,CDE CENTRO ESCOLAR SAN FRANCISCO GOTERA,13192102771015
1,2,3,CDE CENTRO ESCOLAR SAN LUIS DE LA REINA,12161206961022
1,2,3,CDE CENTRO ESCOLAR SAN LUIS LA HERRADURA,08220312011017
1,2,3,CDE CENTRO ESCOLAR SAN MARCOS,06120703971021
1,2,3,CDE CENTRO ESCOLAR SAN MARTIN DE PORRES,06021811021015
1,2,3,CDE CENTRO ESCOLAR SANTA AGUEDA,03011505981025
1,2,3,CDE CENTRO ESCOLAR SANTA EDUVIGES,06171806991016
1,2,3,CDE CENTRO ESCOLAR SANTA RITA,04321610981017
1,2,3,CDE CENTRO ESCOLAR SANTIAGO DE MARIA,11211902460013
1,2,3,CDE CENTRO ESCOLAR SANTIAGO ORELLANA ZELAYA,11042102971058
1,2,3,CDE CENTRO ESCOLAR SANTOS NOVOA,05150703971040
1,2,3,CDE CENTRO ESCOLAR SARA PALMA DE JULE,06022102971057
1,2,3,CDE CENTRO ESCOLAR SARA POHL DE BORGONOVO,12090801981016
1,2,3,CDE CENTRO ESCOLAR SOLEDAD MELARA DE ARGUETA,08192802971023
1,2,3,CDE CENTRO ESCOLAR SOR HENRIQUEZ,09032103971022
1,2,3,CDE CENTRO ESCOLAR SRA ROSA HIRLEMAM DE GARCIA PRIETO,12052302011015
1,2,3,CDE CENTRO ESCOLAR SUSANA RODRIGUEZ VIUDA DE DUKE,11050302971012
1,2,3,CDE CENTRO ESCOLAR TENIENTE CORONEL JOSECARLOS FLORES BENITEZ,08182102971019
1,2,3,CDE CENTRO ESCOLAR TEODORO MORENO,02102102971021
1,2,3,CDE CENTRO ESCOLAR TOMAS ALVA EDISON,07112802971018
1,2,3,CDE CENTRO ESCOLAR TOMAS MEDINA,02102102971048
1,2,3,CDE CENTRO ESCOLAR UNION CENTROAMERICANA,06142102971362
1,2,3,CDE CENTRO ESCOLAR UNION PANAMERICANA,12172102971281
1,2,3,CDE CENTRO ESCOLAR URBANIZACION CALIFORNIA,12171402971015
1,2,3,CDE CENTRO ESCOLAR URBANIZACION CUMBRES DE SAN BARTOLO,06181408131070
1,2,3,CDE CENTRO ESCOLAR URBANIZACION LOS ANGELES,06172802971068
1,2,3,CDE CENTRO ESCOLAR URBANIZACION SANTA TERESA,06131403971010
1,2,3,CDE CENTRO ESCOLAR VALLE DEL SOL,06022102971065
1,2,3,CDE CENTRO ESCOLAR VALLE VERDE,06020303991029
1,2,3,CDE CENTRO ESCOLAR VICENTE ACOSTA,06021403971021
1,2,3,CDE CENTRO ESCOLAR VICTORIA TERESA MENENDEZ V DE ESCALANTE,06142102971842
1,2,3,CDE CENTRO ESCOLAR VICTORIA ZELAYA,14081910981016
1,2,3,CDE CENTRO ESCOLAR VISTA HERMOSA CASERIO CEIBILLA CANTON CONDADILLO,11070402991011
1,2,3,CDE CENTRO ESCOLAR WALTER THILO DEININGER,05012801971012
1,2,3,CDE CENTRO ESCOLARCANTON LA HACHADURA,06140703971260
1,2,3,CDE CENTROESCOLAR DE SANTA ELENA,11182102971038
1,2,3,CDE COMPLEJO EDUCATICO MARCOS GOMEZ NUÑEZ,07020504681013
1,2,3,"CDE COMPLEJO EDUCATIVO "" DOCTOR MICHAEL DE WITTE""",11082410141017
1,2,3,CDE COMPLEJO EDUCATIVO 10 DE OCTUBRE 1987,09082110141075
1,2,3,CDE COMPLEJO EDUCATIVO ALICIA CISNEROS DE ZELAYANDIA,11101211141010
1,2,3,CDE COMPLEJO EDUCATIVO AMINTA DE MONTIEL,12171812021022
1,2,3,CDE COMPLEJO EDUCATIVO ANTONIO ALFARO,06141403971175
1,2,3,CDE COMPLEJO EDUCATIVO BARRA DE SANTIAGO,06140204981106
1,2,3,CDE COMPLEJO EDUCATIVO CACIQUE,14050111971021
1,2,3,CDE COMPLEJO EDUCATIVO CANTON AGUA FRIA,14140111971071
1,2,3,CDE COMPLEJO EDUCATIVO CANTON ATIOCOYO,05171011141037
1,2,3,CDE COMPLEJO EDUCATIVO CANTON EL COCO,06140111971976
1,2,3,CDE COMPLEJO EDUCATIVO CANTON EL JAGUEY,14041402971046
1,2,3,CDE COMPLEJO EDUCATIVO CANTON EL JOCOTE,05162102971017
1,2,3,CDE COMPLEJO EDUCATIVO CANTON EL ZUNZAL,05182802971027
1,2,3,CDE COMPLEJO EDUCATIVO CANTON GUADALUPE LA ZORRA,08220603141015
1,2,3,CDE COMPLEJO EDUCATIVO CANTON JOYAS DE GIRON,08053107141010
1,2,3,CDE COMPLEJO EDUCATIVO CANTON LAS ANIMAS,10082802971014
1,2,3,CDE COMPLEJO EDUCATIVO CANTON LAS ISLETAS,08151403971011
1,2,3,CDE COMPLEJO EDUCATIVO CANTON LAS SALINAS,11230111971010
1,2,3,CDE COMPLEJO EDUCATIVO CANTON PAVANITA,14141402971024
1,2,3,CDE COMPLEJO EDUCATIVO CANTON SAN BARTOLO,06070910141015
1,2,3,CDE COMPLEJO EDUCATIVO CANTON SAN BENITO,04202210141010
1,2,3,CDE COMPLEJO EDUCATIVO CANTON SAN ISIDRO,03062802971024
1,2,3,CDE COMPLEJO EDUCATIVO CANTON SAN LUCAS,03042310141025
1,2,3,CDE COMPLEJO EDUCATIVO CANTON SAN MARCELINO,08152802971021
1,2,3,CDE COMPLEJO EDUCATIVO CANTON VERACRUZ,05020111971012
1,2,3,CDE COMPLEJO EDUCATIVO CAPITAN GENERAL  GERARDO BARRIOS,05182802971019
1,2,3,CDE COMPLEJO EDUCATIVO CAS RANCHO QUEMADO CTON CASA BLANCA,13162710141010
1,2,3,CDE COMPLEJO EDUCATIVO CASERIO BELEN CANTON SUNCITA,03012802971019
1,2,3,CDE COMPLEJO EDUCATIVO CASERIO EL ESPINO CANTON CUYANTEPEQUE,09060511141023
1,2,3,CDE COMPLEJO EDUCATIVO CASERIO EL RODEO CANTON SAN MATIAS,09062802971077
1,2,3,CDE COMPLEJO EDUCATIVO CASERIO LOS ALMENDROS CANTON EL ZAPOTE,07152710141177
1,2,3,CDE COMPLEJO EDUCATIVO CASERIO MONTECRISTO CANTON EL RINCON,09090511141011
1,2,3,CDE COMPLEJO EDUCATIVO CATALINO AMAYA,14112804981018
1,2,3,CDE COMPLEJO EDUCATIVO COLONIA LAS CAÑAS,06072102971038
1,2,3,CDE COMPLEJO EDUCATIVO CONCHA VDA DE ESCALON,06142102972180
1,2,3,CDE COMPLEJO EDUCATIVO CONFEDERACION SUIZA,12171503991033
1,2,3,CDE COMPLEJO EDUCATIVO CRIO LA PIRRAYA CTON ISLA SAN SEBASTIAN,11172310141027
1,2,3,CDE COMPLEJO EDUCATIVO CRISTOBAL IBARRA MEJICANOS,03042102971014
1,2,3,CDE COMPLEJO EDUCATIVO CT BARAHONA,08152704151016
1,2,3,CDE COMPLEJO EDUCATIVO CT CARA SUCIA,06142102971524
1,2,3,CDE COMPLEJO EDUCATIVO CT VAINILLAS,04092102971015
1,2,3,CDE COMPLEJO EDUCATIVO CTON LAS POZAS,01090204981011
1,2,3,CDE COMPLEJO EDUCATIVO DE GUAYMANGO,06141402971317
1,2,3,CDE COMPLEJO EDUCATIVO DE INTIPUCA,14071101001013
1,2,3,CDE COMPLEJO EDUCATIVO DE LISLIQUE,14091403971012
1,2,3,CDE COMPLEJO EDUCATIVO DE POLOROS,14130712011010
1,2,3,CDE COMPLEJO EDUCATIVO DE SAN GERARDO,12141403971039
1,2,3,CDE COMPLEJO EDUCATIVO DE SANTO DOMINGO DE GUZMAN,06142102971605
1,2,3,CDE COMPLEJO EDUCATIVO DELFINADE DIAZ,06060306021014
1,2,3,CDE COMPLEJO EDUCATIVO DOCTOR ARTURO ROMERO,06141402971252
1,2,3,CDE COMPLEJO EDUCATIVO DOCTOR DAVID ESCOLAR GALINDO,06060111971018
1,2,3,CDE COMPLEJO EDUCATIVO DOCTOR JUSTO AGUILAR,10032802971017
1,2,3,CDE COMPLEJO EDUCATIVO DOCTOR VICTORIANORODRIGUEZ,10102802971015
1,2,3,CDE COMPLEJO EDUCATIVO DR GUILLERMO MANUEL UNGO,07152710141010
1,2,3,CDE COMPLEJO EDUCATIVO EBEN EZER CANTON POTRERO SULA,04162102971099
1,2,3,CDE COMPLEJO EDUCATIVO EDUARDO SALAVERRIA,06140703971251
1,2,3,CDE COMPLEJO EDUCATIVO ESCOLAR CANTON EL OCOTAL,04082802971029
1,2,3,CDE COMPLEJO EDUCATIVO FE Y ALEGRIA,06182102971038
1,2,3,CDE COMPLEJO EDUCATIVO FEDERICO GONZALEZ,10090611031014
1,2,3,CDE COMPLEJO EDUCATIVO FLORINDA DE JUAREZ ALEMAN,13112870291011
1,2,3,CDE COMPLEJO EDUCATIVO GENERAL FABIO    MORAN,06142102971702
1,2,3,CDE COMPLEJO EDUCATIVO GENERAL FRANCISCOMENENDEZ,07100703971024
1,2,3,CDE COMPLEJO EDUCATIVO GENERAL MANUEL JOSE ARCE,13102802971016
1,2,3,CDE COMPLEJO EDUCATIVO GOLDTREE LIEBES,06122802971010
1,2,3,CDE COMPLEJO EDUCATIVO ING RODOLFO ENRIQUE VARELA MANZANO,06140409971030
1,2,3,CDE COMPLEJO EDUCATIVO INGENIERO GUILLERMO BORJA NATHAN,06022102971030
1,2,3,CDE COMPLEJO EDUCATIVO JORGE LARDE,06131402971060
1,2,3,CDE COMPLEJO EDUCATIVO JOSE PANTOJA H,14081402971056
1,2,3,CDE COMPLEJO EDUCATIVO JUAN ERNESTO DE BEDOUT,05150806011010
1,2,3,CDE COMPLEJO EDUCATIVO LEANDRO MARIA GUARDADO,04021706981014
1,2,3,CDE COMPLEJO EDUCATIVO LOTIFICACION COMALAPA,08133007141016
1,2,3,CDE COMPLEJO EDUCATIVO MANUEL JOSE ARCE,06111402971019
1,2,3,CDE COMPLEJO EDUCATIVO MARCELINO GARCIA FLAMENCO TOROLA,13242802971012
1,2,3,CDE COMPLEJO EDUCATIVO MARIA MENDOZA DE BARATA,03052802971029
1,2,3,CDE COMPLEJO EDUCATIVO MARISOL BOLAÑOS DE RIVAS,05130402991010
1,2,3,CDE COMPLEJO EDUCATIVO NACIONES UNIDAS,13022802971012
1,2,3,CDE COMPLEJO EDUCATIVO OFELIA HERRERA,12170703971138
1,2,3,CDE COMPLEJO EDUCATIVO PEDRO F CANTOR,06141402971279
1,2,3,CDE COMPLEJO EDUCATIVO PEDRO PABLO CASTILLO,10122802971016
1,2,3,CDE COMPLEJO EDUCATIVO PROF. JOSE WALTERESCALVO NUÑEZ,12031402971019
1,2,3,CDE COMPLEJO EDUCATIVO PROFESOR CARLOS LOBATO,08210703971028
1,2,3,CDE COMPLEJO EDUCATIVO PROFESOR FELIPE HUEZO CORDOVA,08100703971036
1,2,3,CDE COMPLEJO EDUCATIVO PROFESOR MARTIN ROMEO MONTERROSA RODRIGUEZ,02101403971012
1,2,3,CDE COMPLEJO EDUCATIVO PROFESOR PABLO SORIANO URQUILLA,06142802971517
1,2,3,CDE COMPLEJO EDUCATIVO PROFESOR RAUL MORENO CANTON HUISQUIL,14040111911034
1,2,3,CDE COMPLEJO EDUCATIVO PROFESOR REYNALDO PADILLA,08220712011016
1,2,3,CDE COMPLEJO EDUCATIVO PROFESOR VIDAL UMANZOR,14031402971024
1,2,3,CDE COMPLEJO EDUCATIVO RAFAELA SUAREZ,10111402971031
1,2,3,CDE COMPLEJO EDUCATIVO REPUBLICA DE CHINA,03031403971018
1,2,3,CDE COMPLEJO EDUCATIVO ROMILIA BLANCO VIUDA DE BRIOSO,10113101021014
1,2,3,CDE COMPLEJO EDUCATIVO SANTIAGO DE LA FRONTERA,06142102971184
1,2,3,CDE COMPLEJO EDUCATIVO SOR CECILIA SANTILLANA AHUACTZIN,12171208981018
1,2,3,CDE COMPLEJO EDUCATIVO TOMAS CABRERA,06040309991013
1,2,3,CDE COMPLEJO EDUCATIVO WALTER A SOUNDY,05112102971028
1,2,3,CDE CTRO ESC  DR MARIO CALVO MARROQUIN,06142102971516
1,2,3,CDE CTRO ESC DOCTOR RANULFO CASTRO,06140111972271
1,2,3,CDE CTRO ESCOLAR  THOMAS JEFFERSON,03150703971027
1,2,3,CDE CTRO ESCOLAR ANTONIO JOSE CAÑAS,06172102971016
1,2,3,CDE CTRO ESCOLAR COLONIA GUAYACAN,06172102971032
1,2,3,CDE CTRO ESCOLAR FLORINDA B. GONZALEZ,06141403971051
1,2,3,CDE DE EDUC PARVULARIA DEL CENTRO DE DESARROLLO INTEGRAL MEDALLA MILAGROSA,06142103971161
1,2,3,CDE DE ESCUELA DE EDUCACION PARVULARIA COLONIA CENTRO AMERICA,06140404971067
1,2,3,CDE DE LA ESCUELA DE EDUCACION PARVULARIA PROFESORA BERTA ARLINA MOLINA,06021403971030
1,2,3,CDE DEL CENTRO EDUCATIVO INSTITUTO NACIONAL SAN LUIS,06171206961016
1,2,3,CDE DEL CENTRO ESCOLAR COLONIA SENSUNAPAN,03152802971023
1,2,3,CDE DEL CENTRO ESCOLAR DE YUCUAIQUIN,14183006991017
1,2,3,CDE DEL CENTRO ESCOLAR GENERAL FRANCISCO MENENDEZ,06142102971869
1,2,3,CDE DEL CENTRO ESCOLAR ING VICTOR JOSE BATARSE,12172102971257
1,2,3,CDE DEL CENTRO ESCOLAR MEARDI,11022201971018
1,2,3,CDE DEL COMPLEJO EDUCATIVO CAPITAN GENERAL GERARDO BARRIOS,06140111971283
1,2,3,CDE DEL COMPLEJO EDUCATIVO DE BOLIVAR,14021403971014
1,2,3,CDE DEL INST NAC GRAL JAIME ABDUL       GUTIERREZ,03151503961015
1,2,3,CDE DEL INST NAC JOHN F KENNEDY,12181503961016
1,2,3,CDE DEL INSTITUTO NACIONAL DE ANTIGUO CUSCATLAN,05011503961016
1,2,3,CDE DEL INSTITUTO NACIONAL DE EL CARMEN,14051503961012
1,2,3,CDE DEL INSTITUTO NACIONAL DE EL SAUCE,14061503961018
1,2,3,CDE DEL INSTITUTO NACIONAL DE SAN JORGE,12151206961019
1,2,3,CDE DEL INSTITUTO NACIONAL DE SOYAPANGO,06171206961024
1,2,3,CDE DEL INSTITUTO NACIONAL DE ULUAZAPA,12201206961016
1,2,3,CDE DEL INSTITUTO NACIONAL DE ZARAGOZA,06141206961036
1,2,3,CDE DEL INSTITUTO NACIONAL DR FRANCISCO MARTINEZ SUAREZ,04071503961015
1,2,3,CDE DEL INSTITUTO NACIONAL SAN FRANCISCO LEMPA,04230807831011
1,2,3,CDE DEL INSTITUTO NACIONAL SAN PEDRO PERULAPAN,07101206961011
1,2,3,CDE DEL INSTITUTO NACIONAL TECNICO INDUSTRIAL,06141503961070
1,2,3,CDE DIRECTIVO ESCOLAR INSTITUTO NACIONALFRANCISCO GAVIDIA,12171107011018
1,2,3,CDE DOLORES CASTELLLANOS,06142103971153
1,2,3,CDE EL CENTRO ESCOLAR CANTON LOS PATOS,14042102971032
1,2,3,CDE EL CENTRO GUSTAVO VIDES VALDES,05032102971032
1,2,3,CDE EL COMPLEJO EDUCATIVO CTON STA CLARA,14121206961010
1,2,3,CDE EL COMPLEJO EDUCATIVO JOSE MARTI,05112802971070
1,2,3,CDE EL COMPLEJO EDUCATIVO REPUBLICA DEL BRASIL,06141403971299
1,2,3,CDE EL INSTITUTO NACIONAL DANIEL ARIAS,14121206961028
1,2,3,CDE ESC DE EDUC PARV DE LA SALA CUNA BRAULIO SANDOVAL,06141403971230
1,2,3,CDE ESC DE EDUC PARV MARIA SALAZAR VDA  DE MAGAÑA,06142102971788
1,2,3,CDE ESC DE EDUC PARV SANTA ROSA DE LIMA,14161402971050
1,2,3,CDE ESC URB MIXTA UNIF COL SENSUNAPAN,00000000000007
1,2,3,CDE ESC. DE EDUC PARV DR. HUMBERTO ROMERO ALVERGUE,03160703971014
1,2,3,CDE ESCUELA DE EDUACACION PARVULARIA DE SAN SEBASTIAN,10092302011010
1,2,3,CDE ESCUELA DE EDUACION PARVULARIA DOCTOR MIGUEL EDUARDO APARICIO JULE,08190202991010
1,2,3,CDE ESCUELA DE EDUC. PARV. DE GUALOCOCTI,13082202011018
1,2,3,CDE ESCUELA DE EDUCACION  PARVULARIA COLONIA QUEZALTEPEC,05110111971020
1,2,3,CDE ESCUELA DE EDUCACION ESPECIAL DE CHALATENANGO,04071402971052
1,2,3,CDE ESCUELA DE EDUCACION ESPECIAL DE ILOBASCO,09032102971061
1,2,3,CDE ESCUELA DE EDUCACION ESPECIAL DE MEJICANOS,06081804971019
1,2,3,CDE ESCUELA DE EDUCACION ESPECIAL DE ZACATECOLUCA,08212102971058
1,2,3,CDE ESCUELA DE EDUCACION ESPECIAL DEL BARRIO SAN JACINTO,06142103971129
1,2,3,CDE ESCUELA DE EDUCACION ESPECIAL GENERAL ADOLFO O BLANDON,06140703971340
1,2,3,CDE ESCUELA DE EDUCACION ESPECIAL LICENCIADA ELDA OFELIA CAMPOS DE CASTELLON,12170703971090
1,2,3,CDE ESCUELA DE EDUCACION PARV DOLORES DEBRITO,06142802971479
1,2,3,CDE ESCUELA DE EDUCACION PARVULARIA     DE NUEVA ESPARTA,14111402971010
1,2,3,CDE ESCUELA DE EDUCACION PARVULARIA     FEDERICO FROEBEL,12051402971036
1,2,3,CDE ESCUELA DE EDUCACION PARVULARIA     MARIA LUISA MARCIA,14082102971018
1,2,3,CDE ESCUELA DE EDUCACION PARVULARIA ALBERTO MASFERRER,06042102971015
1,2,3,CDE ESCUELA DE EDUCACION PARVULARIA AMATEPEC,06140703971189
1,2,3,CDE ESCUELA DE EDUCACION PARVULARIA ARMENIA,06142102971583
1,2,3,CDE ESCUELA DE EDUCACION PARVULARIA CANTON EL ESPINO,06140111972212
1,2,3,CDE ESCUELA DE EDUCACION PARVULARIA CANTON EL JUTE,05090703971013
1,2,3,CDE ESCUELA DE EDUCACION PARVULARIA CANTON LOURDES,05030111971026
1,2,3,CDE ESCUELA DE EDUCACION PARVULARIA CENTRO URBANO MONSERRAT,06142802971720
1,2,3,CDE ESCUELA DE EDUCACION PARVULARIA COL LAS BRISAS,06171403971015
1,2,3,CDE ESCUELA DE EDUCACION PARVULARIA COLONIA GUADALUPE,06172908971016
1,2,3,CDE ESCUELA DE EDUCACION PARVULARIA COLONIA LA PRESITA,12170801981028
1,2,3,CDE ESCUELA DE EDUCACION PARVULARIA COLONIA MONSERRAT,06141402971325
1,2,3,CDE ESCUELA DE EDUCACION PARVULARIA COLONIA RENSON IRCA,06141804971135
1,2,3,CDE ESCUELA DE EDUCACION PARVULARIA COLONIA SAN BENITO,11230309661025
1,2,3,CDE ESCUELA DE EDUCACION PARVULARIA DE  SAN JULIAN,06140606971107
1,2,3,CDE ESCUELA DE EDUCACION PARVULARIA DE CORINTO,13032802971026
1,2,3,CDE ESCUELA DE EDUCACION PARVULARIA DE JIQUILISCO,11082102971076
1,2,3,CDE ESCUELA DE EDUCACION PARVULARIA DE LA LIBERTAD,05092802971052
1,2,3,CDE ESCUELA DE EDUCACION PARVULARIA DE PUERTO EL TRIUNFO,11140111971011
1,2,3,CDE ESCUELA DE EDUCACION PARVULARIA DE SANTIAGO TEXACUANGOS,06152102971015
1,2,3,CDE ESCUELA DE EDUCACION PARVULARIA DE SOYAPANGO,06172102971024
1,2,3,CDE ESCUELA DE EDUCACION PARVULARIA DE USULUTAN,11232802971010
1,2,3,CDE ESCUELA DE EDUCACION PARVULARIA DE ZARAGOZA,05220703971014
1,2,3,CDE ESCUELA DE EDUCACION PARVULARIA DOCTOR MIGUEL TOMAS MOLINA,08212802971105
1,2,3,CDE ESCUELA DE EDUCACION PARVULARIA DR FEDERICO VIDES,06140111971569
1,2,3,CDE ESCUELA DE EDUCACION PARVULARIA DR REYNALDO GALINDO POHL,07022802971132
1,2,3,CDE ESCUELA DE EDUCACION PARVULARIA DULCE NOMBRE DE MARIA,04081402971015
1,2,3,CDE ESCUELA DE EDUCACION PARVULARIA FEDERICO EVERARDO NOLTENIUS,11021102971018
1,2,3,CDE ESCUELA DE EDUCACION PARVULARIA GABRIELA MISTRAL,06141402971260
1,2,3,CDE ESCUELA DE EDUCACION PARVULARIA HUGO LINDO,06142802971274
1,2,3,CDE ESCUELA DE EDUCACION PARVULARIA IZALCO,03062102971015
1,2,3,CDE ESCUELA DE EDUCACION PARVULARIA JARDINES DE LA SABANA,05112802971045
1,2,3,CDE ESCUELA DE EDUCACION PARVULARIA JOSE CECILIO DEL VALLE,06140111972280
1,2,3,CDE ESCUELA DE EDUCACION PARVULARIA JOSE MARIA SAN MARTIN,05110703971014
1,2,3,CDE ESCUELA DE EDUCACION PARVULARIA JOSE MISAEL RAMOS,09060703971011
1,2,3,CDE ESCUELA DE EDUCACION PARVULARIA MARGARITA OVIEDO DE VENUTOLO,06141402971180
1,2,3,CDE ESCUELA DE EDUCACION PARVULARIA MARIA BEDOYA AGUILAR,07022802971078
1,2,3,CDE ESCUELA DE EDUCACION PARVULARIA MARIA REINA DE LA PAZ,03150206981035
1,2,3,CDE ESCUELA DE EDUCACION PARVULARIA MARTA CARBONEL DE QUITEÑO,06141403971108
1,2,3,CDE ESCUELA DE EDUCACION PARVULARIA NUEVA CONCEPCION,04162102971080
1,2,3,CDE ESCUELA DE EDUCACION PARVULARIA NUEVA GUADALUPE,12102102971020
1,2,3,CDE ESCUELA DE EDUCACION PARVULARIA OVIDIO DECROLY,06142102971338
1,2,3,CDE ESCUELA DE EDUCACION PARVULARIA POPOTLAN,06023003011013
1,2,3,CDE ESCUELA DE EDUCACION PARVULARIA PROF MARIA EMMA CASTRO DE CHIQUILLO,06060111971026
1,2,3,CDE ESCUELA DE EDUCACION PARVULARIA PROF MIRIAM NORA MARTINEZ DE PEREZ,07110111971019
1,2,3,CDE ESCUELA DE EDUCACION PARVULARIA PROFCORDELIA AVALOS DE LABOR,06140111972018
1,2,3,CDE ESCUELA DE EDUCACION PARVULARIA PROFESORA LUISA MORAN CASTRO,06142002011078
1,2,3,CDE ESCUELA DE EDUCACION PARVULARIA PROFESORA MAGOTH TULA DE MORAN,06132010981013
1,2,3,CDE ESCUELA DE EDUCACION PARVULARIA PROFESORA RAFAELA ADELINA FIGUEROA DE PACHECO,06082102971033
1,2,3,CDE ESCUELA DE EDUCACION PARVULARIA ROSAURA ZAPATA,06142102971672
1,2,3,CDE ESCUELA DE EDUCACION PARVULARIA SAN FRANCISCO GOTERA,13192802971023
1,2,3,CDE ESCUELA DE EDUCACION PARVULARIA SAN MARCOS,06121008011013
1,2,3,CDE ESCUELA DE EDUCACION PARVULARIA TONACATEPEQUE,06181402971025
1,2,3,CDE ESCUELA DE EDUCACION PARVULARIA URBANIZACION SANTA TERESA DE SAN MARTIN,06131402971052
1,2,3,CDE ESCUELA DE EDUCACION PARVULARIA ZACAMIL,06141403971094
1,2,3,CDE ESCUELA PARV GRACIELA FLORES VIUDA  DE GRIMALDI,12172102971028
