A,B,C,NOMBRE_PATRONO,NIT_AGRUPADOR
1,2,3,CDE ESCUELA PARVULARIA MARTHA CARBONEL DE QUITEÑO,10010703971010
1,2,3,CDE ESCUELA PARVULARIA NACIONAL BARRIO EL MOLINO,11230703971013
1,2,3,CDE EUMU PBRO FERNANDO H SAN GERMAN,06141104971053
1,2,3,CDE FRANCISCO GAVIDIA,05030111971034
1,2,3,CDE INS NAC CONCEPCION BATRES,11041503961016
1,2,3,CDE INS NAC STA ISABEL ISHUATAN,00000000000004
1,2,3,CDE INST NAC DE ALEGRIA,11011206961019
1,2,3,CDE INST NAC DE BERLIN,11021206961014
1,2,3,CDE INST NAC DE JUCUARAN,11101206961018
1,2,3,CDE INST NAC DE MERCEDES UMAÑA,11110706961013
1,2,3,CDE INST NAC DE SAN JULIAN,03121503961019
1,2,3,CDE INST NAC DE STGO DE MARIA,11211206961018
1,2,3,CDE INST NAC DIV THOMAS JEFFERSON,03151605961028
1,2,3,CDE INSTITUTO NAC DE SAN SIMON,13213005961010
1,2,3,CDE INSTITUTO NACIONAL                  LIC RENE PORFIRIO OSORIO,06141206961079
1,2,3,CDE INSTITUTO NACIONAL 14 DE JULIO DE 1875,13191503961015
1,2,3,CDE INSTITUTO NACIONAL ALBERT CAMUS,06141206961133
1,2,3,CDE INSTITUTO NACIONAL ANAMOROS,14011206961010
1,2,3,CDE INSTITUTO NACIONAL AUGUSTO CESAR ROMERO,08161206961018
1,2,3,CDE INSTITUTO NACIONAL BERTHA FIDELIA CAÑAS,06121206961019
1,2,3,CDE INSTITUTO NACIONAL CANTON LAS PILAS,04251003031010
1,2,3,CDE INSTITUTO NACIONAL CANTON LOURDES,05031206961016
1,2,3,CDE INSTITUTO NACIONAL CANTON TIERRA BLANCA,11081206961025
1,2,3,CDE INSTITUTO NACIONAL CASERIO EL COYOLITO CANTON QUITAZOL,04331206961024
1,2,3,CDE INSTITUTO NACIONAL COLONIA VALLE DELSOL,06022602031018
1,2,3,CDE INSTITUTO NACIONAL CORNELIO AZENON SIERRA,01031503961012
1,2,3,CDE INSTITUTO NACIONAL CRISTOBAL IGLESIAS,09071911981014
1,2,3,CDE INSTITUTO NACIONAL DE AGUILARES,06011206961019
1,2,3,CDE INSTITUTO NACIONAL DE APASTEPEQUE,10011206961015
1,2,3,CDE INSTITUTO NACIONAL DE ARCATAO,04021312041016
1,2,3,CDE INSTITUTO NACIONAL DE ARMENIA,03021206961013
1,2,3,CDE INSTITUTO NACIONAL DE AYUTUXTEPEQUE,06031206961010
1,2,3,CDE INSTITUTO NACIONAL DE AZACUALPA,04031206961012
1,2,3,CDE INSTITUTO NACIONAL DE CAROLINA,12011206961012
1,2,3,CDE INSTITUTO NACIONAL DE CHAPELTIQUE,12043011991013
1,2,3,CDE INSTITUTO NACIONAL DE CHINAMECA,12051206961014
1,2,3,CDE INSTITUTO NACIONAL DE CIUDAD ARCE,05020306961011
1,2,3,CDE INSTITUTO NACIONAL DE CIUDAD BARRIOS,12171206961036
1,2,3,CDE INSTITUTO NACIONAL DE CIUDAD CREDISA,06173006991010
1,2,3,CDE INSTITUTO NACIONAL DE CIUDAD DELGADO,06191206961017
1,2,3,CDE INSTITUTO NACIONAL DE COATEPEQUE,02020601031017
1,2,3,CDE INSTITUTO NACIONAL DE COMERCIO,06141206661148
1,2,3,CDE INSTITUTO NACIONAL DE CONCEPCION QUEZALTEPEQUE,04062704011016
1,2,3,CDE INSTITUTO NACIONAL DE CORINTO,13031206961017
1,2,3,CDE INSTITUTO NACIONAL DE EL DIVISADERO,13061206961013
1,2,3,CDE INSTITUTO NACIONAL DE EL PAISNAL,06051503961011
1,2,3,CDE INSTITUTO NACIONAL DE EL PARAISO,04103006991015
1,2,3,CDE INSTITUTO NACIONAL DE EL ROSARIO,07040301071024
1,2,3,CDE INSTITUTO NACIONAL DE ESTANZUELAS,11071206961011
1,2,3,CDE INSTITUTO NACIONAL DE GUALOCOCTI,13080904131019
1,2,3,CDE INSTITUTO NACIONAL DE GUATAJIAGUA,13093005011016
1,2,3,CDE INSTITUTO NACIONAL DE ILOBASCO,09031112981018
1,2,3,CDE INSTITUTO NACIONAL DE JIQUILISCO,11081206961017
1,2,3,CDE INSTITUTO NACIONAL DE JUAYUA,06141206961125
1,2,3,CDE INSTITUTO NACIONAL DE LA COL SANTA LUCIA,06071503961020
1,2,3,CDE INSTITUTO NACIONAL DE LA COLONIA CIUDAD OBRERA APOPA,06021503961023
1,2,3,CDE INSTITUTO NACIONAL DE LA LAGUNA,04111206961016
1,2,3,CDE INSTITUTO NACIONAL DE LA PALMA,04121206961011
1,2,3,CDE INSTITUTO NACIONAL DE LA REINA,04131206961017
1,2,3,CDE INSTITUTO NACIONAL DE LA UNION,14081503961019
1,2,3,CDE INSTITUTO NACIONAL DE MONSERRAT,06141206961044
1,2,3,CDE INSTITUTO NACIONAL DE NOMBRE DE JESUS,04152511981017
1,2,3,CDE INSTITUTO NACIONAL DE NUEVA CONCEPCION,04161206961021
1,2,3,CDE INSTITUTO NACIONAL DE NUEVA ESPARTA,14111206961014
1,2,3,CDE INSTITUTO NACIONAL DE NUEVA GUADALUPE,12102304971013
1,2,3,CDE INSTITUTO NACIONAL DE NUEVO CUSCATLAN,05100501091017
1,2,3,CDE INSTITUTO NACIONAL DE OLOCUILTA,08051206961018
1,2,3,CDE INSTITUTO NACIONAL DE OSICALA,13151206961012
1,2,3,CDE INSTITUTO NACIONAL DE OZATLAN,11131206961014
1,2,3,CDE INSTITUTO NACIONAL DE PERQUIN,13162211981015
1,2,3,CDE INSTITUTO NACIONAL DE POTONICO,06141206961168
1,2,3,CDE INSTITUTO NACIONAL DE PUERTO EL TRIUNFO,11141206961010
1,2,3,CDE INSTITUTO NACIONAL DE SAN ANTONIO LOS RANCHOS,04211409011018
1,2,3,CDE INSTITUTO NACIONAL DE SAN ANTONIO MASAHUAT,08072109981010
1,2,3,CDE INSTITUTO NACIONAL DE SAN EMIGDIO,08083006991019
1,2,3,CDE INSTITUTO NACIONAL DE SAN FERNANDO,04222402091018
1,2,3,CDE INSTITUTO NACIONAL DE SAN FRANCISCO JAVIER,11190111971019
1,2,3,CDE INSTITUTO NACIONAL DE SAN IGNACIO,04251206961012
1,2,3,CDE INSTITUTO NACIONAL DE SAN ISIDRO,13200611141015
1,2,3,CDE INSTITUTO NACIONAL DE SAN JUAN OPICO,05151206961011
1,2,3,CDE INSTITUTO NACIONAL DE SAN JUAN TEPEZONTES,08121503961017
1,2,3,CDE INSTITUTO NACIONAL DE SAN LUIS LA HERRADURA,08221206961010
1,2,3,CDE INSTITUTO NACIONAL DE SAN LUIS TALPA,08131503961012
1,2,3,CDE INSTITUTO NACIONAL DE SAN MARCOS,06121503961010
1,2,3,CDE INSTITUTO NACIONAL DE SAN MATIAS,05161009011015
1,2,3,CDE INSTITUTO NACIONAL DE SAN PABLO TACACHICO,05171206961012
1,2,3,CDE INSTITUTO NACIONAL DE SAN RAFAEL,04311503991012
1,2,3,CDE INSTITUTO NACIONAL DE SANTA ELENA,11181206961011
1,2,3,CDE INSTITUTO NACIONAL DE SANTA MARIA OSTUMA,08181206961019
1,2,3,CDE INSTITUTO NACIONAL DE SANTIAGO TEXACUANGOS,06141206961141
1,2,3,CDE INSTITUTO NACIONAL DE SANTO DOMINGO,10050602011017
1,2,3,CDE INSTITUTO NACIONAL DE SENSUNTEPEQUE,09062203961012
1,2,3,CDE INSTITUTO NACIONAL DE SESORI,12191206961010
1,2,3,CDE INSTITUTO NACIONAL DE SN ANTONIO    SILVA,12171206961044
1,2,3,CDE INSTITUTO NACIONAL DE TECOLUCA,10111206961010
1,2,3,CDE INSTITUTO NACIONAL DE TEOTEPEQUE,05201206961019
1,2,3,CDE INSTITUTO NACIONAL DE TEXISTEPEQUE,02131206961010
1,2,3,CDE INSTITUTO NACIONAL DE TONACATEPEQUE,06141206961150
1,2,3,CDE INSTITUTO NACIONAL DE VICTORIA,09081911981010
1,2,3,CDE INSTITUTO NACIONAL DE YAMABAL,13252309031014
1,2,3,CDE INSTITUTO NACIONAL DOCTOR SARBELIO NAVARRETE,10101206961014
1,2,3,CDE INSTITUTO NACIONAL DR MANUEL LUIS ESCAMILLA,08011206961016
1,2,3,CDE INSTITUTO NACIONAL DR PEDRO MIGUEL RIVERA DAMAS,10061206961012
1,2,3,CDE INSTITUTO NACIONAL DR SALVADOR ANTONIO NAVARRETE AZURDIA,09091911981015
1,2,3,CDE INSTITUTO NACIONAL ERNESTO FLORES,11051206961010
1,2,3,CDE INSTITUTO NACIONAL ESTADO DE ISRAEL,08031206961017
1,2,3,CDE INSTITUTO NACIONAL GENERAL FRANCISCO MORAZAN,06141206961060
1,2,3,CDE INSTITUTO NACIONAL GENERAL JESUS MARIA BRAN,06141206961176
1,2,3,CDE INSTITUTO NACIONAL GENERAL JUAN ORLANDO ZEPEDA,04071405921013
1,2,3,CDE INSTITUTO NACIONAL GRAL MANUEL JOSE ARCE,06142406961045
1,2,3,CDE INSTITUTO NACIONAL HEBER REMBERTO TRUJILLO DIAZ,05071206961018
1,2,3,CDE INSTITUTO NACIONAL JOAQUIN ERNESTO CARDENAS,12172102971338
1,2,3,CDE INSTITUTO NACIONAL JOSE DAMIAN VILLACORTA,05110111971011
1,2,3,CDE INSTITUTO NACIONAL JOSE INGENIEROS,08191206961014
1,2,3,CDE INSTITUTO NACIONAL JOSE MARIA PERALTA LAGOS,05121206961015
1,2,3,CDE INSTITUTO NACIONAL JUAN PABLO II,06091503961013
1,2,3,CDE INSTITUTO NACIONAL LICDO JOSE DANIEL CARIAS,06142802971525
1,2,3,CDE INSTITUTO NACIONAL LUIS REYNALDO TOBAR,06141206961117
1,2,3,CDE INSTITUTO NACIONAL METROPOLITANO,12171206961052
1,2,3,CDE INSTITUTO NACIONAL MONSEÑOR TOMAS MIGUEL PINEDA Y SALDAÑA,08150108991012
1,2,3,CDE INSTITUTO NACIONAL PABLO TESAK,11082310141028
1,2,3,CDE INSTITUTO NACIONAL PROF. ROSA ORBELINA CAÑAS DE FLORES,00000000000008
1,2,3,CDE INSTITUTO NACIONAL PROFESOR FRANCISCO GUERRERO,08170108991013
1,2,3,CDE INSTITUTO NACIONAL PROFESOR FRANCISCO VENTURA ZELAYA,14161503961012
1,2,3,CDE INSTITUTO NACIONAL PROFESOR JAIME FRANCISCO LOPEZ,06141206961044
1,2,3,CDE INSTITUTO NACIONAL PROFESOR JOSE LUIS LOPEZ,13121206961016
1,2,3,CDE INSTITUTO NACIONAL PROFESOR SANTIAGO ECHEGOYEN,10021206961010
1,2,3,CDE INSTITUTO NACIONAL PUERTO DE LA LIBERTAD,05091206961019
1,2,3,CDE INSTITUTO NACIONAL REPUBLICA DE ITALIA,04331206961016
1,2,3,CDE INSTITUTO NACIONAL RUFINO GUEVARA,04011206961011
1,2,3,CDE INSTITUTO NACIONAL SAN ILDEFONSO,10070511981014
1,2,3,CDE INSTITUTO NACIONAL SAN JOSE GUAYABAL,07091206961016
1,2,3,CDE INSTITUTO NACIONAL SAN JOSE VERAPAZ,10131206961010
1,2,3,CDE INSTITUTO NACIONAL SAN LUIS DE LA REINA,12161209891014
1,2,3,CDE INSTITUTO NACIONAL SAN MIGUEL DE MERCEDES,04300601031017
1,2,3,CDE INSTITUTO NACIONAL SAN RAFAEL CEDROS,07111206961017
1,2,3,CDE INSTITUTO NACIONAL SANTA MARIA,11200501981010
1,2,3,CDE INSTITUTO NACIONAL SEGUNDO MONTES,13141206961017
1,2,3,CDE INSTITUTO NACIONAL SIMON BOLIVAR,06161904831013
1,2,3,CDE INSTITUTO NACIONAL TECPAN,05152706011016
1,2,3,CDE INSTITUTO NACIONAL TENANCINGO,07161206961014
1,2,3,CDE INSTITUTO NACIONAL WALTER THILO DEININGER,08021503961019
1,2,3,CDE JESUS ESCOBAR DE CARDENAS,12171106971018
1,2,3,CDE JUAN ENRIQUE PESTALOZZI,03100703971011
1,2,3,CDE MANUEL MONEDERO,06140111971330
1,2,3,CDE REPARTO SAN JOSE II,06172802971041
1,2,3,CDE REPUBLICA DE NICARAGUA,00000000000003
1,2,3,CDE VILLA GUACOTECTI,09022802971016
6,,,CELULA DE SEGUIMIENTO Y CIERRE DEL PROGRAMA DE APOYO AL PROCESO PRODUCTIVO EN SAN VICENTE,06141211971066
6,2,3,CENTRO DE FORMACION LABORAL,06142710991058
3,2,3,CENTRO ESCOLAR CATOLICO SANTA LUISA,06142805571072
3,12,13,CENTRO INTERNACIONAL DE FERIAS Y CONVENCIONES DE EL SALVADOR,06142402071010
3,5,2,CENTRO NACIONAL DE REGISTROS,06140512941026
3,6,1,CENTRO NACIONAL DE TECNOLOGIA AGROPECUARIA Y FORESTAL,05110104100011
2,9,9,CEPA,06141402370078
2,9,9,CEPA- FENASAL,06141402370078
6,,,CIRCUITO DE TEATROS NACIONALES,06142101110042
6,,,COMISION DE DERECHOS HUMANOS DE EL SALVADOR,06142708820037
6,,,COMISION DE INVESTIGACION DE HECHOS DELICTIVOS,06140407850031
6,,,COMISION DEL NUEVO MILENIO,06141711991047
2,9,9,COMISION EJECUTIVA DEL PUERTO DE ACAJUTL,00000000000001
2,9,9,COMISION EJECUTIVA DEL PUERTO DE ACAJUTLA,00000000000001
2,9,9,COMISION EJECUTIVA DEL RIO LEMPA,06141809480014
2,9,9,COMISION EJECUTIVA HIDROELECTRICA DEL RIO LEMPA,06141809480014
2,9,9,COMISION EJECUTIVA HIDROELECTRICIA DEL R,06141809480014
2,9,9,COMISION EJECUTIVA HIDROLECTRICA DEL RIO LEMPA,06141809480014
2,9,9,COMISION EJECUTIVA PORTUARIA AUTONOMA,06141402370078
2,9,9,COMISION EJECUTIVA PORTUARIA AUTONOMA FE,06141402370078
2,9,9,COMISION EJECUTIVA PORTUARIA AUTONOMA FENASAL,06141402370078
2,9,9,COMISION EJECUTIVA PORTUERIA AUTONOMA,06141402370078
6,,,COMISION NACIONAL DE ASISTENCIA A LA POBLACION DESPLAZADA,06142910810011
3,5,2,COMISION NACIONAL DE LA MICRO Y PEQUEÑA EMPRESA,06140305961025
3,5,2,COMISION NACIONAL DE PROMOCION DE INVERSIONES,06140302001071
6,,,COMISION REVISADORA DE LA LEGISLACION SALVADOREÑA,06141706850064
3,12,13,COMITE EJECUTIVO DE LA FERIA INTERNACIONAL DE EL SALVADOR,06142202650017
3,12,15,COMITE ORGANIZADOR DE LOS V JUEGOS DEPOR,06140806921082
3,2,3,COMPLEJO EDUCATIVO CATOLICO ANA GUERRA DE JESUS,10050112001013
3,2,3,COMPLEJO EDUCATIVO CATOLICO PRESBITERO RENE VALLE,10060112001019
6,,,CONSEJO CENTRAL DE ELECCIONES,06140101110036
3,14,2,CONSEJO DE VIGILANCIA DE LA PROFESION DE CONTADURIA PUBLICA Y AUDITORIA,06142601001030
1,2,3,CONSEJO DIRECTIVO ESCOLAR  CENTRO ESCOLAR COMUNIDAD PRADERA III,06192102971041
1,2,3,CONSEJO DIRECTIVO ESCOLAR  INSTITUTO NACIONAL EL TRANSITO,12071503961016
1,2,3,CONSEJO DIRECTIVO ESCOLAR BENITO JUAREZ,06140111972131
1,2,3,CONSEJO DIRECTIVO ESCOLAR CANTON LLANOS DE ACHICHILCO,10102110141063
1,2,3,CONSEJO DIRECTIVO ESCOLAR CANTON SAN ANTONIO EL GUAYABO,10012110141013
1,2,3,CONSEJO DIRECTIVO ESCOLAR CANTON SANTA  GERTRUDIS,10103010141011
1,2,3,CONSEJO DIRECTIVO ESCOLAR CASERIO SAN LAZARO CANTON SAN PEDRO,10013010141020
1,2,3,"CONSEJO DIRECTIVO ESCOLAR CENTRO ESCOLAR "" DOCTOR JACINTO CASTELLANOS""",10102802971082
1,2,3,CONSEJO DIRECTIVO ESCOLAR CENTRO ESCOLAR BUENA VISTA,06171403971023
1,2,3,CONSEJO DIRECTIVO ESCOLAR CENTRO ESCOLAR CANTON GUAYAPA ABAJO,06140703971286
1,2,3,CONSEJO DIRECTIVO ESCOLAR CENTRO ESCOLAR CANTON LAS TRANCAS,11131405981016
1,2,3,CONSEJO DIRECTIVO ESCOLAR CENTRO ESCOLAR CANTON SAN CRISTOBAL,06142102971435
1,2,3,CONSEJO DIRECTIVO ESCOLAR CENTRO ESCOLAR CARLOS ARNULFO CRESPIN,04072102771023
1,2,3,CONSEJO DIRECTIVO ESCOLAR CENTRO ESCOLAR CASERIO EL JUNQUILLAL CANTON CHANMOCO,10102102971014
1,2,3,CONSEJO DIRECTIVO ESCOLAR CENTRO ESCOLAR CASERIO LAS FLORES CANTON PARRAS LEMPA,10103010141020
1,2,3,CONSEJO DIRECTIVO ESCOLAR CENTRO ESCOLAR COLONIA BELEN,14080111971010
1,2,3,CONSEJO DIRECTIVO ESCOLAR CENTRO ESCOLAR COLONIA FATIMA,07022802971116
1,2,3,CONSEJO DIRECTIVO ESCOLAR CENTRO ESCOLAR COLONIA SANTA CRUZ,06142802971215
1,2,3,CONSEJO DIRECTIVO ESCOLAR CENTRO ESCOLAR DE SAN DIONISIO,11172802971017
1,2,3,CONSEJO DIRECTIVO ESCOLAR CENTRO ESCOLAR DR. SIXTO ALBERTO PADILLA,06140111972123
1,2,3,CONSEJO DIRECTIVO ESCOLAR CENTRO ESCOLAR EMILIO MARTINEZ,02100111971074
1,2,3,CONSEJO DIRECTIVO ESCOLAR CENTRO ESCOLAR EUGENIO AGUILAR TRIGUEROS,06142802971460
1,2,3,CONSEJO DIRECTIVO ESCOLAR CENTRO ESCOLAR FLORENCIA RIVAS,07110703971020
1,2,3,CONSEJO DIRECTIVO ESCOLAR CENTRO ESCOLAR GENERAL FRANCISCO MENENDEZ,09030703971015
1,2,3,CONSEJO DIRECTIVO ESCOLAR CENTRO ESCOLAR HACIENDA SAN CAYETANO CANTON CAMONES,06140111971780
1,2,3,CONSEJO DIRECTIVO ESCOLAR CENTRO ESCOLAR HACIENDA SAN MIGUEL CTON EL COBANAL,05030702971017
1,2,3,CONSEJO DIRECTIVO ESCOLAR CENTRO ESCOLAR JOSE LUCIO MARTINEZ,06140111971208
1,2,3,CONSEJO DIRECTIVO ESCOLAR CENTRO ESCOLAR JOSE MARIANO MENDEZ,06140111971437
1,2,3,CONSEJO DIRECTIVO ESCOLAR CENTRO ESCOLAR LYNDON B JOHNSON,06142102972130
1,2,3,CONSEJO DIRECTIVO ESCOLAR CENTRO ESCOLAR MANUELA MINERO DE MEJIA,08122802971017
1,2,3,CONSEJO DIRECTIVO ESCOLAR CENTRO ESCOLAR MONSEÑOR JOSE LOPEZ SANDOVAL,06142802971185
1,2,3,CONSEJO DIRECTIVO ESCOLAR CENTRO ESCOLAR MONSEÑOR LUIS CHAVEZ Y GONZALEZ,07042802971036
1,2,3,CONSEJO DIRECTIVO ESCOLAR CENTRO ESCOLAR RAFAEL CAMPO,03152802971031
1,2,3,CONSEJO DIRECTIVO ESCOLAR CENTRO ESCOLAR SAN LUIS GONZAGA,05112102971010
1,2,3,CONSEJO DIRECTIVO ESCOLAR CENTRO ESCOLAR URBANIZACION LAS MARGARITAS,06171402971011
1,2,3,CONSEJO DIRECTIVO ESCOLAR CENTRO ESCOLARALTAVISTA,06180902991018
1,2,3,CONSEJO DIRECTIVO ESCOLAR CENTRO ESCOLARCANTON EL OJUSTE,11230509971037
1,2,3,CONSEJO DIRECTIVO ESCOLAR CENTRO ESCOLARCANTON SAN PEDRO,12060702971010
1,2,3,CONSEJO DIRECTIVO ESCOLAR CENTRO ESCOLARCOMUNIDAD SAN BARTOLO DEL NORTE,06071403971010
1,2,3,CONSEJO DIRECTIVO ESCOLAR CENTRO ESCOLARJOSE DOLORES LARREYNAGA,05120111971025
1,2,3,CONSEJO DIRECTIVO ESCOLAR CENTRO ESCOLARJUAN PABLO DUARTE,03122102971011
1,2,3,CONSEJO DIRECTIVO ESCOLAR CENTRO ESCOLARPRESBITERO JOSE MATIAS DELGADO,14162102971011
1,2,3,CONSEJO DIRECTIVO ESCOLAR COMPLEJO EDUCATIVO  HACIENDA LA LABOR,06142802971410
1,2,3,CONSEJO DIRECTIVO ESCOLAR COMPLEJO EDUCATIVO CANTON EL SUNZA,03062102971040
1,2,3,CONSEJO DIRECTIVO ESCOLAR COMPLEJO EDUCATIVO CANTON EL ZAPOTE,01082802971010
1,2,3,CONSEJO DIRECTIVO ESCOLAR COMPLEJO EDUCATIVO CANTON TONALA,03152205981018
1,2,3,CONSEJO DIRECTIVO ESCOLAR COMPLEJO EDUCATIVO COLONIA NUEVA,06140703971235
1,2,3,CONSEJO DIRECTIVO ESCOLAR COMPLEJO EDUCATIVO COLONIA QUIÑONEZ,06140111971364
1,2,3,CONSEJO DIRECTIVO ESCOLAR COMPLEJO EDUCATIVO CTON EL JICARO,06142910141083
1,2,3,CONSEJO DIRECTIVO ESCOLAR COMPLEJO EDUCATIVO DOCTOR MANUEL PARADA SALGADO,06142102971346
1,2,3,CONSEJO DIRECTIVO ESCOLAR COMPLEJO EDUCATIVO DR HUMBERTO ROMERO ALVERGUE,06140312991029
1,2,3,CONSEJO DIRECTIVO ESCOLAR COMPLEJO EDUCATIVO GARITA PALMERA,06142802971690
1,2,3,CONSEJO DIRECTIVO ESCOLAR COMPLEJO EDUCATIVO GRAL. MANUEL JOSE ARCE,13102802971016
1,2,3,CONSEJO DIRECTIVO ESCOLAR COMPLEJO EDUCATIVO HACIENDA METALIO,03010703971039
1,2,3,CONSEJO DIRECTIVO ESCOLAR COMPLEJO EDUCATIVO PROFESOR ALBERTO VARELA,08111312011013
1,2,3,CONSEJO DIRECTIVO ESCOLAR COMPLEJO EDUCATIVO TECAPAN,11220108991013
1,2,3,CONSEJO DIRECTIVO ESCOLAR CT ESC EL CONG,06140111971178
1,2,3,CONSEJO DIRECTIVO ESCOLAR CTR ESC SOTERO,09060610961016
1,2,3,CONSEJO DIRECTIVO ESCOLAR DE CENTRO ESCOLAR CANTON CHANTUSNENE,05152505981017
1,2,3,CONSEJO DIRECTIVO ESCOLAR DE ESC URBANA MIXTA UNIF BO EL CAMPAMENTO FE Y ALEGRIA,06142802971347
1,2,3,CONSEJO DIRECTIVO ESCOLAR DE LA ESC URB DE NIÑAS UNIF. DOLORES DE BRITO,03152802971015
1,2,3,"CONSEJO DIRECTIVO ESCOLAR DEL           CENTRO ESCOLAR ""JOSE MARTI""",06140111971518
1,2,3,CONSEJO DIRECTIVO ESCOLAR DEL CENTRO ESCOLAR DE ARMENIA,03022102971013
1,2,3,CONSEJO DIRECTIVO ESCOLAR DEL INSTITUTO NACIONAL DE APOPA,06021503961015
1,2,3,CONSEJO DIRECTIVO ESCOLAR DEL INSTITUTO NACIONAL DE IZALCO,03061206961015
1,2,3,CONSEJO DIRECTIVO ESCOLAR DEL INSTITUTO NACIONAL DE JUCUAPA,11091206961012
1,2,3,CONSEJO DIRECTIVO ESCOLAR DEL INSTITUTO NACIONAL DE SONZACATE,03162205031015
1,2,3,CONSEJO DIRECTIVO ESCOLAR DEL INSTITUTO NACIONAL MAESTRO ALBERTO MASFERRER,06080109820011
1,2,3,CONSEJO DIRECTIVO ESCOLAR E R M CASERIO LAS CANOAS CANTON SAN JUAN,06142102971125
1,2,3,"CONSEJO DIRECTIVO ESCOLAR ESCUELA DE    EDUCACION ESPECIAL DE ""USULUTAN""",11232102971027
1,2,3,CONSEJO DIRECTIVO ESCOLAR ESCUELA DE EDUACACION PARVULARIA DE SAN ISIDRO,09050111971013
1,2,3,CONSEJO DIRECTIVO ESCOLAR ESCUELA DE EDUCACION PARVULARIA ANTIGUO CUSCATLAN,05012102971015
1,2,3,CONSEJO DIRECTIVO ESCOLAR ESCUELA DE EDUCACION PARVULARIA BARRIO EL CALVARIO,11232802971036
1,2,3,CONSEJO DIRECTIVO ESCOLAR ESCUELA DE EDUCACION PARVULARIA EL CONGO,06140111971321
1,2,3,CONSEJO DIRECTIVO ESCOLAR ESCUELA DE EDUCACION PARVULARIA SAN RAFAEL OBRAJUELO,08170102991011
1,2,3,CONSEJO DIRECTIVO ESCOLAR INS NAC ISIDRO MENENDEZ,12171206961028
1,2,3,CONSEJO DIRECTIVO ESCOLAR INSTITUTO     NACIONAL CANTON EL PACUN,10110507021016
1,2,3,CONSEJO DIRECTIVO ESCOLAR INSTITUTO NAC CANDELARIA LA FRONTERA,02011503961015
1,2,3,CONSEJO DIRECTIVO ESCOLAR INSTITUTO NACIONAL ALEJANDRO DE HUMBOLDT AHUACHAPAN,01011206961010
1,2,3,CONSEJO DIRECTIVO ESCOLAR INSTITUTO NACIONAL CANTON CARA SUCIA,01082803031010
1,2,3,CONSEJO DIRECTIVO ESCOLAR INSTITUTO NACIONAL DE JUJUTLA,06142303011073
1,2,3,CONSEJO DIRECTIVO ESCOLAR INSTITUTO NACIONAL DE LOLOTIQUE,12081206961010
1,2,3,CONSEJO DIRECTIVO ESCOLAR INSTITUTO NA--CIONAL DE MONCAGUA,12090406961014
1,2,3,CONSEJO DIRECTIVO ESCOLAR INSTITUTO NACIONAL DE SACACOYO,05130301021010
1,2,3,CONSEJO DIRECTIVO ESCOLAR INSTITUTO NACIONAL DE SAN BARTOLO,06071503961012
1,2,3,CONSEJO DIRECTIVO ESCOLAR INSTITUTO NACIONAL DE SANTA ANA,02101206961013
1,2,3,CONSEJO DIRECTIVO ESCOLAR INSTITUTO NACIONAL JOSE RIVERA CAMPOS,05041206961011
1,2,3,CONSEJO DIRECTIVO ESCOLAR INSTITUTO NACIONAL JOSE SIMEO CAÑAS,08210805981010
1,2,3,CONSEJO DIRECTIVO ESCOLAR INSTITUTO NACIONAL NUEVA ESPERANZA DEL BAJO LEMPA,11080511991019
1,2,3,CONSEJO DIRECTIVO ESCOLAR LEOPOLDO MAYENTORRES,02102102971013
1,2,3,CONSEJO DIRECTIVO ESCOLAR LIC HECTOR MAURICIO PALOMO SOL,06142102971273
1,2,3,CONSEJO DIRECTIVO ESCOLAR PROFESOR LUIS ARMANDO ROBLES,14142610011014
1,2,3,CONSEJO DIRECTIVO ESCOLAR SALVADOR HIDALGO CORNEJO,10022102971029
1,2,3,CONSEJO DIRECTIVO ESCOLAR SOR CLARA QUIROZ,05030703971010
3,14,6,CONSEJO NACIONAL DE ADMINISTRACION DE BIENES,06142811131041
3,1,12,CONSEJO NACIONAL DE ATENCION INTEGRAL A LA PERSONA CON DISCAPACIDAD,06140612931087
3,5,2,CONSEJO NACIONAL DE CALIDAD,06142107111060
3,2,3,CONSEJO NACIONAL DE CIENCIA Y TECNOLOGIA,06140103131071
3,5,2,CONSEJO NACIONAL DE ENERGIA,06143008071052
6,,,CONSEJO NACIONAL DE LA JUDICATURA,06142201931020
3,14,3,CONSEJO NACIONAL DE LA NIÑEZ Y DE LA ADOLESCENCIA,06140101111014
3,12,3,CONSEJO NACIONAL PARA LA CULTURA Y EL   ARTE,06142009911058
3,14,2,CONSEJO SALVADOREÑO DE LA AGROINDUSTRIA AZUCARERA,06142607011061
3,14,15,CONSEJO SALVADOREÑO DE MENORES,06141101240054
3,6,1,CONSEJO SALVADOREÑO DEL CAFE,06141910891035
3,1,11,CONSEJO SUPERIOR DE SALUD PUBLICA,06141601220019
6,,,CONVENIO DE COOPERACION TECNICO AGRICOLA ENTRE EL SALVADOR Y LA REPUBLICA CHINA,06140910790038
3,10,2,CORPORACION SALVADOREÑA DE INVERSIONES,06140101820011
3,8,13,CORPORACION SALVADOREÑA DE TURISMO,06142507961054
6,,,CORTE DE CUENTAS DE LA REPUBLICA,06140101110070
6,,,CRUZ ROJA SALVADOREÑA,06141303850013
1,14,4,CUERPO DE BOMBEROS DE EL SALVADOR,06140101021015
3,14,2,DEFENSORIA DEL CONSUMIDOR,06141808051014
1,14,15,DIRECCION DE ASESORIA LEGAL MINISTERIO  DEL INTERIOR,06140101021015
1,4,6,DIRECCION GENERAL DE CENTROS PENALES Y  READAPTACION,06140101071012
1,4,6,DIRECCION GENERAL DE MIGRACION,06140101071012
3,14,15,DIRECCION GENERAL DE PROTECCION AL CONSUMIDOR,06143108921126
6,,,DIRECCION MUNICIPAL PARA LA GESTION SUSTENTABLE DE DESECHOS SOLIDOS,06142201081069
3,1,11,DIRECCION NACIONAL DE MEDICAMENTOS,06140203121057
1,14,11,DIRECCION REGIONAL DE SALUD CENTRAL,06140101220032
1,14,11,DIRECCION REGIONAL DE SALUD METROPOLITANA,06140101220032
1,14,11,DIRECCION REGIONAL DE SALUD OCCIDENTAL,06140101220032
1,14,11,DIRECCION REGIONAL DE SALUD ORIENTAL,06140101220032
1,14,11,DIRECCION REGIONAL DE SALUD PARACENTRAL,06140101220032
3,6,1,ESCUELA NACIONAL DE AGRICULTURA ROBERTO QUIÑONEZ,05020603840011
1,3,7,FAES PARA LA VTA DE PROD Y PREST DE SERV DEL CMDO DE APOYO LOGISTICO DE LA FA,06140101160060
2,9,9,FERROCARRILES NACIONALES DE EL SALVADOR,06141402370078
4,10,15,FINANCIERA NACIONAL DE TIERRAS AGRICOLAS,06140602790076
6,,,FISCALIA GENERAL DE LA REPUBLICA,06140101150030
6,,,FISCALIA REGIONAL DE OCCIDENTE,06140101150030
3,7,8,FONDO AMBIENTAL DE EL SALVADOR,06141606941042
1,3,7,FONDO DE ACTIVIDADES ESPECIALES DE MEDIOS DE COMUNICACION Y REPRODUCCION DE LA FUERZA ARMADA,06140101160060
1,7,8,FONDO DE ACTIVIDADES ESPECIALES DEL MARN,06141605971045
1,14,14,FONDO DE ACTVIDADES ESPC POR LA VENTA DESERV PUBLIC DE RADIO NAC DE EL SALV,06140101021015
6,,,FONDO DE CONSERVACION VIAL,06143011001057
3,10,2,FONDO DE FINANCIAMIENTO Y GARANTIA PARA LA PEQUEÑA EMPRESA,06140102360044
3,10,2,FONDO DE FINANCIAMIENTO Y GTIA PEQUEÑA E,07471010236101
3,10,2,FONDO DE FINANCIAMIENTO Y GTIA PEQUEÑAS,07471010236101
3,10,2,FONDO DE FINANTO Y GTIA PARA LA PEQUEÑA EMPRESA,07471010236101
3,10,3,FONDO DE GARANTIA PARA CREDITO EDUCATIVO,06141005730030
5,,,FONDO DE INVERCION EDUCATIVA DE ALCALDIAIPAL DE DULCE NOMBRE DE MARIA,04080509510010
3,14,9,FONDO DE INVERSION NACIONAL EN ELECTRICIDAD Y TELEFONIA,06140907981035
3,14,9,FONDO DE INVERSION SOCIAL PARA EL DESARROLLO LOCAL DE EL SALVADOR,06143110901027
3,1,12,FONDO DE PROTECCION DE LISIADOS Y DISCAPACITADOS A CONSECUENCIA CONFLICTO ARMADO,06141312921019
3,14,16,FONDO DE SANEAMIENTO Y FORTALECIMIENTO FINANCIERO,06141512901020
3,14,16,FONDO DEL MILENIO,06142012061154
3,14,16,FONDO DEL MILENIO II,06143010141076
4,10,16,FONDO NACIONAL DE VIVIENDA  POPULAR,06140806921040
3,14,9,FONDO PARA LA ATENCION A LAS VICTIMAS DE ACCIDENTES DE TRANSITO,06141412121036
6,,,FONDO PROTECCION FUNCIONARIOS Y EMPLEADOS DEL BANCO CENTRAL DE RESERVA,06142801630010
3,14,5,FONDO SALVADORENO PARA ESTUDIOS DE PREINVERSION,06140611780060
4,10,9,FONDO SOCIAL PARA LA VIVIENDA,06140705750026
3,10,16,FONDO SOLIDARIO PARA LA FAMILIA MICROEMPRESARIA,06142605991042
3,14,16,GTZ PROGRAMA DE INTEGRACION Y FOMENTO DEEMPLEO,93092803561016
3,1,11,HOSPITAL NACIONAL DE CHALCHUAPA,02032212951010
3,1,11,HOSPITAL NACIONAL DE ILOBASCO,09031006961016
3,1,11,HOSPITAL NACIONAL DE JIQUILISCO,06141006961058
3,1,11,"HOSPITAL NACIONAL DE LA MUJER ""DOCTORA MARIA ISABEL RODRIGUEZ",06143102220012
3,1,11,HOSPITAL NACIONAL DE LA UNION,14082212951012
3,1,11,HOSPITAL NACIONAL DE METAPAN,02071006961012
3,1,11,HOSPITAL NACIONAL DE NIÑOS BENJAMIN BLOOM,06142102220025
3,1,11,HOSPITAL NACIONAL DE NUEVA CONCEPCION,04161406961018
3,1,11,HOSPITAL NACIONAL DE NUEVA GUADALUPE,12100108881011
3,1,11,HOSPITAL NACIONAL DR HECTOR ANTONIO    HERNANDEZ FLORES SAN FRANCISCO GOTERA,13191603871013
3,1,11,"HOSPITAL NACIONAL DR JORGE MAZZINI VILLACORTA, SONSONATE",03151802220016
3,1,11,HOSPITAL NACIONAL DR JOSE ANTONIO ZALDAÑA NEUMOLOGIA Y MEDICINA FAMILIAR,06141502220042
3,1,11,HOSPITAL NACIONAL DR JUAN JOSE FERNANDEZ ZACAMIL,06141905891043
3,1,11,HOSPITAL NACIONAL FRANCISCO MENENDEZ,01012812831013
3,1,11,HOSPITAL NACIONAL FRANCISCO MENENDEZ DE AHUACHAPAN,01012812831013
3,1,11,HOSPITAL NACIONAL LUIS EDMUNDO VASQUEZ,04071902220015
3,1,11,HOSPITAL NACIONAL MONSEÑOR OSCAR ARNULFO ROMERO Y GALDAMEZ CIUDAD BARRIOS,12021006961013
3,1,11,HOSPITAL NACIONAL NUESTRA SENORA DE FATIMA,07021006961013
3,1,11,HOSPITAL NACIONAL PSIQUIATRICO DR JOSE  MOLINA MARTINEZ,06171402220019
3,1,11,HOSPITAL NACIONAL ROSALES,06141102220026
3,1,11,HOSPITAL NACIONAL SAN BARTOLO ENFERMERA ANGELICA VIDAL DE NAJARRO,06141006961040
3,1,11,HOSPITAL NACIONAL SAN JUAN DE DIOS      DE SAN MIGUEL,12171302220016
3,1,11,HOSPITAL NACIONAL SAN JUAN DE DIOS DE SANTA ANA,02101602220018
3,1,11,HOSPITAL NACIONAL SAN PEDRO USULUTAN,11231102220020
3,1,11,HOSPITAL NACIONAL SAN RAFAEL,05110102220013
3,1,11,HOSPITAL NACIONAL SANTA GERTRUDIS SAN VICENTE,10101102220016
3,1,11,HOSPITAL NACIONAL SANTA ROSA DE LIMA,14162212951016
3,1,11,HOSPITAL NACIONAL SANTA TERESA,08212102220020
3,1,11,HOSPITAL NACIONAL SANTIAGO DE MARIA,11211406961012
3,1,11,HOSPITAL NACIONAL SENSUNTEPEQUE,09061006961012
3,1,11,HOSPITAL NACIONAL SUCHITOTO,07151406961013
3,6,1,INST SALV DE TRANSFORMACION AGRARIA,06143101310030
6,,,INSTITUTO DE ACCESO A LA INFORMACION PUBLICA,06142302131105
3,14,9,INSTITUTO DE LEGALIZACION DE LA PROPIEDAD,06142602911048
3,14,7,INSTITUTO DE PREVISION SOCIAL DE LA FUERZA ARMADA,06142002780033
3,2,10,INSTITUTO ESPECIALIZADO DE EDUCACION SUPERIOR PARA LA FORMACION DIPLOMATICA,06142408101078
6,,,INSTITUTO MUNICIPAL DE DEPORTES Y RECREACION,06141107061074
3,2,3,INSTITUTO NACIONAL CANTON SAN JOSE LOS SITIOS,05190401991010
3,12,14,INSTITUTO NACIONAL DE LOS DEPORTES DE E S PROVISION DE SERVICIOS DE SALUD PARA ATLETAS DE ALTO RENDIMIENTO,06142806800021
3,6,15,INSTITUTO NACIONAL DEL AZUCAR,06142005800020
3,14,5,INSTITUTO NACIONAL PENSIONES EMPLEADOS  PUBLICOS,06142410750025
3,1,15,INSTITUTO SALV DE REHABILITAC DE INVAL,04070504540023
3,2,3,INSTITUTO SALVADOREÑO DE BIENESTAR MAGISTERIAL,06142211071037
6,,,INSTITUTO SALVADOREÑO DE DESARROLLO MUNICIPAL,06140403871018
